[
  { "id": "AC-0001", "slice": "SLC-0001", "statement": "A POST /orders request with quantity <= 0 is rejected with HTTP 400 and the same error the legacy system returns", "behaviors": ["BHV-0004"], "failure_path": true },
  { "id": "AC-0002", "slice": "SLC-0001", "statement": "A POST /orders request with quantity > 0 succeeds and publishes an order.created event keyed by the order id", "behaviors": ["BHV-0001"] }
]
